player,id,wazamei,damage,kakuritu,key,desc,yuuri,kind,heal,guard
1,0,怪しいささやき,10,100,q,怪しい攻撃。成功確率100％。,2,normal,0,0.6
1,1,催眠攻撃,30,60,w,催眠攻撃。成功確率60％。,0,normal,0,0.9
1,2,宗教勧誘,50-70,40,e,必殺技。有名な洗脳攻撃。声で一番つらいところを攻めた残虐無比な強攻撃。成功確率30％。,1,charge,0,0.8
1,3,神のご加護,0,100,r,神を信仰する。成功確率100％。HPを30回復できる。,,heal,30,0
2,0,キャラを憑依,5,100,i,ゲームのキャラになりきり攻撃をする。成功確率100%,2,normal,0,0.7
2,1,黒炎,35,55,o,かなり熱い炎。めっちゃ熱い。成功確率35%。,0,normal,0,0.8
2,2,ブラックホール,40-75,45,p,必殺技。すべてを破壊する。しかも成功確率45%です。,1,charge,0,0.7
2,3,自己再生,0,100,u,回復技。成功確率100%。HPを30回復できる。,,heal,30,0